{
  "$schema": "https://json-schema.org/draft/2020-12/schema",
  "$id": "https://ai300game.local/contracts/code-review.schema.json",
  "title": "Code Review Item",
  "type": "object",
  "required": [
    "id",
    "type",
    "domain",
    "topic",
    "difficulty",
    "source",
    "content"
  ],
  "additionalProperties": false,
  "properties": {
    "id":           { "type": "string", "format": "uuid" },
    "type":         { "const": "code-review" },
    "domain":       { "$ref": "#/$defs/domain" },
    "topic":        { "type": "string", "minLength": 1 },
    "difficulty":   { "type": "integer", "minimum": 1, "maximum": 3 },
    "source":       { "$ref": "#/$defs/source" },
    "reviewer_id":  { "type": "string", "minLength": 1 },
    "reviewed_at":  { "type": "string", "format": "date-time" },
    "tags":         { "type": "array", "items": { "type": "string" } },
    "content": {
      "type": "object",
      "required": ["sub_mode", "language", "snippet", "prompt", "options", "correct", "explanation"],
      "additionalProperties": false,
      "properties": {
        "sub_mode":    { "enum": ["find-the-bug", "what-does-this-do", "fill-the-blank"] },
        "language":    { "enum": ["python", "yaml", "bash"] },
        "snippet":     { "type": "string", "minLength": 1, "maxLength": 2000 },
        "prompt":      { "type": "string", "minLength": 1, "maxLength": 200 },
        "options": {
          "type": "object",
          "required": ["A", "B", "C", "D"],
          "additionalProperties": false,
          "properties": {
            "A": { "type": "string", "minLength": 1, "maxLength": 240 },
            "B": { "type": "string", "minLength": 1, "maxLength": 240 },
            "C": { "type": "string", "minLength": 1, "maxLength": 240 },
            "D": { "type": "string", "minLength": 1, "maxLength": 240 }
          }
        },
        "correct":     { "enum": ["A", "B", "C", "D"] },
        "explanation": { "type": "string", "minLength": 1, "maxLength": 1200 }
      }
    }
  },
  "allOf": [
    {
      "if":   { "properties": { "source": { "const": "ai-generated" } } },
      "then": { "required": ["reviewer_id", "reviewed_at"] }
    }
  ],
  "$defs": {
    "domain": {
      "enum": [
        "mlops-infra",
        "ml-lifecycle",
        "genaiops-infra",
        "genai-quality",
        "genai-optimization"
      ]
    },
    "source": { "enum": ["bank", "ai-generated"] }
  }
}
